{
  "$schema": "http://json-schema.org/draft-07/schema#",
  "title": "Generated schema for Root",
  "type": "object",
  "properties": {
    "count": {
      "type": "number"
    },
    "next": {},
    "previous": {},
    "results": {
      "type": "array",
      "items": {
        "type": "object",
        "properties": {
          "id": {
            "type": "number"
          },
          "club": {
            "type": "number"
          },
          "user": {
            "type": "object",
            "properties": {
              "id": {
                "type": "number"
              },
              "username": {
                "type": "string"
              }
            },
            "required": [
              "id",
              "username"
            ]
          },
          "review": {
            "type": "string"
          },
          "assessment": {
            "type": "number"
          },
          "readPages": {
            "type": "number"
          },
          "created": {
            "type": "string"
          },
          "modified": {}
        },
        "required": [
          "id",
          "club",
          "user",
          "review",
          "assessment",
          "readPages",
          "created",
          "modified"
        ]
      }
    }
  },
  "required": [
    "count",
    "next",
    "previous",
    "results"
  ]
}