{
  "count": 2,
  "next": null,
  "previous": null,
  "results": [
    {
      "id": 13,
      "club": 1,
      "user": {
        "id": 105,
        "username": "Ken_1782311250"
      },
      "review": "Eligendi ducimus odio doloremque ea soluta minima quidem ad quibusdam.",
      "assessment": 3,
      "readPages": 497,
      "created": "2026-06-24T14:27:41.223164Z",
      "modified": null
    },
    {
      "id": 11,
      "club": 1,
      "user": {
        "id": 95,
        "username": "Marya_1782238199"
      },
      "review": "afsfsfsfsafs fasfdflkjl;j;lj;lk ;ljlkjlkj",
      "assessment": 5,
      "readPages": 10,
      "created": "2026-06-24T10:30:47.288424Z",
      "modified": null
    }
  ]
}